<?xml version="1.0" encoding="UTF-8"?>
<admissions xmlns:xsi="http://www.w3.org/2001/XMLSchema-instance"
  xsi:noNamespaceSchemaLocation="../../schema/admission.xsd">
  <page>admission</page>
  <cards>
    <card>
      <icon>bi-gear-wide-connected</icon>
      <text>Enrollment Process For New Students</text>
      <link>newstudents.php</link>
    </card>
    <card>
      <icon>bi-file-earmark-text</icon>
      <text>Enrollment Process For Current Students</text>
      <link>currentstudents.php</link>
    </card>
    <card>
      <icon>bi-file-earmark-check</icon>
      <text>Grade Levels Offered</text>
      <link>gradelevels.php</link>
    </card>
    <card>
      <icon>bi-patch-plus</icon>
      <text>Requirements for New Applicants</text>
      <link>requirements.php</link>
    </card>
  </cards>
</admissions>
